[
  {
    "check_id": "CONSIST-001",
    "category": "整体检查",
    "name": "项目名称一致性",
    "description": "标书全文涉及的项目名称应与招标文件一致。",
    "severity": "CRITICAL",
    "verification_method": "rule",
    "evidence_required": [
      "招标文件项目名称",
      "投标文件项目名称"
    ],
    "rule": {
      "operator": "equal",
      "fields": [
        "tender.project_name",
        "bid.project_name"
      ]
    },
    "source_ck": "直投CK/整体检查/一致性检查"
  },
  {
    "check_id": "CONSIST-002",
    "category": "整体检查",
    "name": "项目编号一致性",
    "description": "项目编号应与招标文件保持一致。",
    "severity": "CRITICAL",
    "verification_method": "rule",
    "evidence_required": [
      "招标文件项目编号",
      "投标文件项目编号"
    ],
    "rule": {
      "operator": "equal",
      "fields": [
        "tender.project_id",
        "bid.project_id"
      ]
    },
    "source_ck": "直投CK/整体检查/一致性检查"
  },
  {
    "check_id": "CONSIST-003",
    "category": "整体检查",
    "name": "项目包号一致性",
    "description": "多包项目必须正确区分项目总编号与包号。",
    "severity": "CRITICAL",
    "verification_method": "rule",
    "evidence_required": [
      "招标文件包号",
      "投标文件包号"
    ],
    "rule": {
      "operator": "equal",
      "fields": [
        "tender.package_id",
        "bid.package_id"
      ]
    },
    "source_ck": "直投CK/整体检查/一致性检查"
  },
  {
    "check_id": "CONSIST-004",
    "category": "整体检查",
    "name": "投标人名称一致性",
    "description": "投标人名称应与招标要求及营业执照等材料一致。",
    "severity": "CRITICAL",
    "verification_method": "rule",
    "evidence_required": [
      "招标文件投标人要求",
      "投标文件投标人名称",
      "营业执照"
    ],
    "rule": {
      "operator": "equal",
      "fields": [
        "bid.bidder_name",
        "license.company_name"
      ]
    },
    "source_ck": "直投CK/投标人、分项报价表、资质材料"
  },
  {
    "check_id": "AUTH-001",
    "category": "授权",
    "name": "法人代表/被授权人信息",
    "description": "授权文件中的法人代表、被授权人等关键信息应满足招标文件要求并保持一致。",
    "severity": "CRITICAL",
    "verification_method": "hybrid",
    "evidence_required": [
      "招标文件授权要求",
      "法人代表授权书",
      "投标人信息表"
    ],
    "rule": {
      "operator": "field_consistency",
      "pairs": [
        [
          "authorization.legal_representative",
          "bid.legal_representative"
        ]
      ]
    },
    "source_ck": "直投CK/授权"
  },
  {
    "check_id": "BOND-001",
    "category": "保证金",
    "name": "保证金金额",
    "description": "保证金金额应满足招标文件要求。",
    "severity": "CRITICAL",
    "verification_method": "hybrid",
    "evidence_required": [
      "招标文件保证金要求",
      "银行回单/收据"
    ],
    "rule": {
      "operator": "gte",
      "actual_field": "bond.amount",
      "required_field": "requirement.bond_amount"
    },
    "source_ck": "直投CK/保证金"
  },
  {
    "check_id": "BOND-002",
    "category": "保证金",
    "name": "保证金收款账户",
    "description": "保证金收款方/账户应与招标文件一致。",
    "severity": "CRITICAL",
    "verification_method": "rule",
    "evidence_required": [
      "招标文件收款方",
      "银行回单"
    ],
    "rule": {
      "operator": "equal",
      "fields": [
        "bond.payee",
        "requirement.bond_payee"
      ]
    },
    "source_ck": "直投CK/整体检查/投标保证金内容检查"
  },
  {
    "check_id": "COMM-001",
    "category": "商务偏离表",
    "name": "商务要求完整响应",
    "description": "招标文件全部商务要求应有对应响应，不得遗漏。",
    "severity": "CRITICAL",
    "verification_method": "hybrid",
    "evidence_required": [
      "招标文件商务要求",
      "商务偏离表",
      "投标文件对应章节"
    ],
    "rule": {
      "operator": "coverage",
      "source": "tender.commercial_requirements",
      "target": "bid.commercial_responses",
      "min_coverage": 1.0
    },
    "source_ck": "直投CK/商务偏离表"
  },
  {
    "check_id": "COMM-002",
    "category": "商务偏离表",
    "name": "商务偏离项不得遗漏",
    "description": "即使招标文件未提供商务偏离表格式，也应在投标文件中完整响应商务要求。",
    "severity": "CRITICAL",
    "verification_method": "hybrid",
    "evidence_required": [
      "招标文件商务条款",
      "投标文件商务响应"
    ],
    "rule": {
      "operator": "coverage",
      "source": "tender.commercial_requirements",
      "target": "bid.commercial_responses",
      "min_coverage": 1.0
    },
    "source_ck": "直投CK/商务偏离表"
  },
  {
    "check_id": "TECH-001",
    "category": "投标清单",
    "name": "产品参数响应",
    "description": "投标产品参数不得低于招标文件的实质性要求。",
    "severity": "CRITICAL",
    "verification_method": "hybrid",
    "evidence_required": [
      "招标文件技术参数",
      "投标技术参数表",
      "产品证明材料"
    ],
    "rule": {
      "operator": "parameter_compare",
      "direction": "bid_meets_or_exceeds"
    },
    "source_ck": "直投CK/投标清单/设备选型"
  },
  {
    "check_id": "TECH-002",
    "category": "产品资质",
    "name": "产品资质完整性",
    "description": "检测报告、节能、3C、产品彩页等材料应按招标要求准备。",
    "severity": "HIGH",
    "verification_method": "hybrid",
    "evidence_required": [
      "招标文件资质要求",
      "产品资质材料"
    ],
    "rule": {
      "operator": "coverage",
      "source": "tender.product_cert_requirements",
      "target": "bid.product_certificates",
      "min_coverage": 1.0
    },
    "source_ck": "直投CK/产品资质"
  },
  {
    "check_id": "EXP-001",
    "category": "业绩",
    "name": "业绩数量与时间",
    "description": "业绩应满足招标文件要求的数量及时间范围。",
    "severity": "HIGH",
    "verification_method": "hybrid",
    "evidence_required": [
      "评分表/业绩要求",
      "业绩汇总表",
      "合同/验收材料"
    ],
    "rule": {
      "operator": "count_and_date_window"
    },
    "source_ck": "直投CK/业绩"
  },
  {
    "check_id": "EXP-002",
    "category": "业绩",
    "name": "业绩合同金额",
    "description": "若招标文件规定单个合同金额下限，应逐项验证。",
    "severity": "HIGH",
    "verification_method": "hybrid",
    "evidence_required": [
      "招标文件业绩要求",
      "合同"
    ],
    "rule": {
      "operator": "gte",
      "actual_field": "experience.contract_amount",
      "required_field": "requirement.experience_contract_amount"
    },
    "source_ck": "直投CK/业绩"
  },
  {
    "check_id": "PRICE-001",
    "category": "分项报价表",
    "name": "同型号价格一致",
    "description": "同一型号产品不得出现不同报价。",
    "severity": "HIGH",
    "verification_method": "rule",
    "evidence_required": [
      "分项报价表"
    ],
    "rule": {
      "operator": "same_value_by_key",
      "key": "product.model",
      "value": "product.unit_price"
    },
    "source_ck": "直投CK/分项报价表"
  },
  {
    "check_id": "PRICE-002",
    "category": "分项报价表",
    "name": "小计及合计公式",
    "description": "分项小计和总计应计算正确。",
    "severity": "CRITICAL",
    "verification_method": "rule",
    "evidence_required": [
      "分项报价表"
    ],
    "rule": {
      "operator": "recalculate_totals"
    },
    "source_ck": "直投CK/投标报价"
  },
  {
    "check_id": "PRICE-003",
    "category": "投标报价",
    "name": "报价不超过限价",
    "description": "报价不得超过招标文件规定的投标限价/拦标价。",
    "severity": "CRITICAL",
    "verification_method": "rule",
    "evidence_required": [
      "招标文件限价",
      "投标报价表"
    ],
    "rule": {
      "operator": "lte",
      "actual_field": "bid.total_price",
      "required_field": "tender.price_ceiling"
    },
    "source_ck": "直投CK/整体检查"
  },
  {
    "check_id": "MODEL-001",
    "category": "产品参数",
    "name": "投标型号可追溯",
    "description": "参数虚高或使用检测报告型号时，应能确认投标型号真实存在并可追溯。",
    "severity": "HIGH",
    "verification_method": "hybrid",
    "evidence_required": [
      "投标型号",
      "产品检测报告",
      "产品资料/官方资料"
    ],
    "rule": {
      "operator": "evidence_presence"
    },
    "source_ck": "直投CK/产品参数"
  },
  {
    "check_id": "DOC-001",
    "category": "整体检查",
    "name": "废标项逐条响应",
    "description": "招标文件中的废标/无效/必须/实质性等要求应逐条检查并落实。",
    "severity": "CRITICAL",
    "verification_method": "hybrid",
    "evidence_required": [
      "招标文件废标条款",
      "投标文件对应响应"
    ],
    "rule": {
      "operator": "coverage",
      "source": "tender.rejection_requirements",
      "target": "bid.responses",
      "min_coverage": 1.0
    },
    "source_ck": "直投CK/整体检查"
  },
  {
    "check_id": "CONSIST-005",
    "category": "一致性检查",
    "name": "检测报告信息一致",
    "description": "偏离表中的检测报告名称、编号、条目应与实际检测报告一致。",
    "severity": "HIGH",
    "verification_method": "rule",
    "evidence_required": [
      "偏离表",
      "检测报告"
    ],
    "rule": {
      "operator": "field_consistency",
      "pairs": [
        [
          "deviation.test_report_name",
          "report.name"
        ],
        [
          "deviation.test_report_no",
          "report.number"
        ]
      ]
    },
    "source_ck": "直投CK/一致性检查"
  },
  {
    "check_id": "CONSIST-006",
    "category": "一致性检查",
    "name": "技术方案不得出现其他项目名称",
    "description": "投标文件技术方案中不应出现其他项目名称等明显串标/错项风险信息。",
    "severity": "CRITICAL",
    "verification_method": "llm",
    "evidence_required": [
      "投标文件全文",
      "招标项目名称"
    ],
    "rule": null,
    "source_ck": "直投CK/整体检查"
  }
]